{"$schema":"https://json-schema.org/draft/2020-12/schema","$id":"dogfooding-registry.v1","type":"object","additionalProperties":false,"required":["schema_version","project_id","north_star_id","monitoring_mode","observations","lesson_candidates","promotions"],"properties":{"schema_version":{"const":"dogfooding-registry.v1"},"project_id":{"const":"PROJECT-FOUNDRY"},"north_star_id":{"const":"PF-NORTH-STAR-001"},"monitoring_mode":{"type":"string","minLength":1},"observations":{"type":"array","items":{"type":"object","additionalProperties":false,"required":["id","status","fact","impact","source_type","source_ref","interpretation"],"properties":{"id":{"type":"string","minLength":1},"status":{"type":"string","minLength":1},"fact":{"type":"string","minLength":1},"impact":{"type":"string","minLength":1},"source_type":{"type":"string","minLength":1},"source_ref":{"type":"string","minLength":1},"interpretation":{"type":"string","minLength":1}}}},"lesson_candidates":{"type":"array","items":{"type":"object","additionalProperties":false,"required":["id","observation_refs","statement","generalization_status","candidate_carriers"],"properties":{"id":{"type":"string","minLength":1},"observation_refs":{"type":"array","items":{"type":"string","minLength":1},"uniqueItems":true,"minItems":1},"statement":{"type":"string","minLength":1},"generalization_status":{"type":"string","minLength":1},"candidate_carriers":{"type":"array","items":{"type":"string","minLength":1},"uniqueItems":true,"minItems":1}}}},"promotions":{"type":"array","items":{"type":"object","additionalProperties":false,"required":["id","lesson_id","status","authority","carrier_refs","evidence_refs"],"properties":{"id":{"type":"string","minLength":1},"lesson_id":{"type":"string","minLength":1},"status":{"type":"string","minLength":1},"authority":{"type":"string","minLength":1},"carrier_refs":{"type":"array","items":{"type":"string","minLength":1},"uniqueItems":true,"minItems":1},"evidence_refs":{"type":"array","items":{"type":"string","minLength":1},"uniqueItems":true,"minItems":1}}}}}}
